{
  "pattern_id": "DP-0012",
  "title": "Bata Sango invocation",
  "tempo_bpm": 132,
  "metric_ratio": "12:8",
  "ensemble_ref": "ENS-Bata-3",
  "cultural_annotation": {
    "orisha_id": "Sango",
    "ceremony_type": "festival",
    "regional_variant": "Oyo",
    "source_drummer_id": "Alhaji Adewale Ayinla",
    "validation_status": "master-validated",
    "recording_uri": "corpus/DP-0012.wav"
  },
  "rhythmic_layers": [
    {
      "layer_id": "LY-0012-1",
      "instrument_role": "iya-ilu",
      "pulse_unit": "semiquaver",
      "metric_cycle_length": 12,
      "offset_pulses": 0,
      "stroke_events": [
        {
          "event_id": "EV-1",
          "pulse_position": 1,
          "stroke_type": "open",
          "pitch_register": "high",
          "duration_pulses": 1,
          "dynamics": "f",
          "pitch_glide": null
        },
        {
          "event_id": "EV-2",
          "pulse_position": 3,
          "stroke_type": "muted",
          "pitch_register": "mid",
          "duration_pulses": 1,
          "dynamics": "mf",
          "pitch_glide": null
        },
        {
          "event_id": "EV-3",
          "pulse_position": 5,
          "stroke_type": "slap",
          "pitch_register": "low",
          "duration_pulses": 1,
          "dynamics": "mf",
          "pitch_glide": null
        },
        {
          "event_id": "EV-4",
          "pulse_position": 9,
          "stroke_type": "open",
          "pitch_register": "glide",
          "duration_pulses": 2,
          "dynamics": "mf",
          "pitch_glide": {
            "start_register": "mid",
            "end_register": "high",
            "glide_direction": "ascending",
            "duration_pulses": 2
          }
        }
      ]
    },
    {
      "layer_id": "LY-0012-2",
      "instrument_role": "omele-abo",
      "pulse_unit": "semiquaver",
      "metric_cycle_length": 8,
      "offset_pulses": 0,
      "stroke_events": [
        {
          "event_id": "EV-5",
          "pulse_position": 1,
          "stroke_type": "open",
          "pitch_register": "low",
          "duration_pulses": 1,
          "dynamics": "mf",
          "pitch_glide": null
        },
        {
          "event_id": "EV-6",
          "pulse_position": 5,
          "stroke_type": "open",
          "pitch_register": "low",
          "duration_pulses": 1,
          "dynamics": "mf",
          "pitch_glide": null
        }
      ]
    }
  ]
}